{"control_references":["comp-find graded denominator contract"],"denominator":{"count":1,"generated_by":"comp-find gitignore-aware file enumerator; unreadable residue printed separately","grain":"readable file scanned"},"discrimination_certificate_ref":null,"instrument":{"id":"comp-find","version":"d0e197633b6da07cc00a67f285c1d9ff3e7057a6"},"invalidation_predicates":["comp-find blob changes","pathspec population changes"],"observed_at":"2026-08-21T01:10:00Z","plane":"DESIRED","population_predicate":"gitignore-aware readable files within the declared pathspec","request_hash":"sha256:7dcb1f098354b2db6a87ce4199851a517747cd379bac15cbc1e5f06bd22fd3c6","status":{"acquisition":"PRESENT","enumeration":"SUCCEEDED","parse":"SUCCEEDED","transport":"SUCCEEDED"},"substantive_result":{"reason":null,"state":"KNOWN","value":{"files_scanned":1,"hits":1,"stdout_digest":"sha256:4584774ff162001765b014c4d803d2ba692fd8c2f82b6ae2792cf6e664b0e62d"}},"substrate":"codebase","support_pointers":[".tools/comp-find @ 017ee5f3f8acd07f9c01bc738f920f9519ab3f4e"],"traversal_residue":[]}
