{"control_references":["comp-estate --self-test","comp-estate --head verdict-preserving contract"],"denominator":{"count":null,"generated_by":"comp-estate engine enumeration with its verdict-preserving footer","grain":"C2-motif chain instance"},"discrimination_certificate_ref":null,"instrument":{"id":"comp-estate","version":"1f646d7c26d95dff3af19b5eee74e81385709ff7"},"invalidation_predicates":["comp-estate engine blob changes","estate snapshot or producer source changes"],"observed_at":"2026-08-20T20:40:00Z","plane":"DESIRED","population_predicate":"C3.ii verticals and their live-derived chain population selected by comp-estate argv","request_hash":"sha256:743dc3258f26f8acb61a7c65961a2354560aea57d15faad59adcc70f69f654e3","status":{"acquisition":"ABSENT","enumeration":"NOT_ATTEMPTED","parse":"NOT_ATTEMPTED","transport":"NOT_ATTEMPTED"},"substantive_result":{"reason":"comp-estate acquisition absent: C:\\Users\\AndrewBerman\\Desktop\\ajb_workspace\\org\\tier1_exec\\4.0.0_SA_CRO~A\\deliverables\\NFRA_EPISTEMY.C1-ENVELOPE\\fixtures\\deliberately-absent-tool","state":"UNKNOWN","value":null},"substrate":"codebase","support_pointers":["C:/Users/AndrewBerman/Desktop/ajb_workspace/org/tier1_exec/4.0.0_SA_CRO~A/deliverables/NFRA_EPISTEMY.C1-ENVELOPE/fixtures/deliberately-absent-tool @ 82c3f36f2427bec74d41864e73129365532c7ea3","C:/Users/AndrewBerman/Desktop/ajb_workspace/org/modules/graph/opal_estate_infrastructure.py @ 82c3f36f2427bec74d41864e73129365532c7ea3"],"traversal_residue":["C:\\Users\\AndrewBerman\\Desktop\\ajb_workspace\\org\\tier1_exec\\4.0.0_SA_CRO~A\\deliverables\\NFRA_EPISTEMY.C1-ENVELOPE\\fixtures\\deliberately-absent-tool"]}
